{
  "format": "hyper-finalized-recording-handoff",
  "format_version": 1,
  "metadata": {
    "format": "hyper-recording-metadata",
    "format_version": 1,
    "id": "018f47a2-6b2d-7c11-8a44-001122334477",
    "project_id": "018f47a2-6b2d-7c11-8a44-001122334455",
    "asset_id": "018f47a2-6b2d-7c11-8a44-001122334478",
    "track_id": "018f47a2-6b2d-7c11-8a44-001122334456",
    "capture_kind": "new",
    "captured_at_utc": "2026-07-29T14:00:00.000Z",
    "timeline_start_tick": 7680,
    "source_input_indices": [0, 1],
    "sample_rate_hz": 48000,
    "channels": 2,
    "frame_count": 2,
    "extensions": {}
  },
  "recording": {
    "path": "/var/lib/hyper/recordings/018f47a2-6b2d-7c11-8a44-001122334478.wav",
    "media_type": "audio/wav",
    "byte_length": 60,
    "sha256": "0123456789abcdef0123456789abcdef0123456789abcdef0123456789abcdef"
  },
  "extensions": {}
}
